{
  "categories": [
    "website",
    "software",
    "ai-tool",
    "skill"
  ],
  "platforms": [
    "web",
    "windows",
    "mac",
    "linux",
    "ios",
    "android"
  ],
  "pricing": [
    "free",
    "freemium",
    "paid"
  ],
  "tags": [
    "photo-editing",
    "image-editing",
    "graphic-design",
    "file-transfer",
    "stock-photos",
    "malware-scan",
    "url-scan",
    "security",
    "weather-map",
    "computation",
    "knowledge-engine",
    "price-tracking",
    "app-installer",
    "software-discovery",
    "random",
    "entertainment",

    "design",
    "productivity",
    "finance",
    "shopping",
    "dev-tools",
    "research",
    "networking",

    "wolfram",
    "adobe",
    "google",
    "anthropic",

    "developer",
    "designer",
    "student",
    "researcher",
    "general-consumer",
    "shopper",
    "system-admin",

    "no-signup",
    "browser-only",
    "offline-capable",
    "extension",
    "cli",

    "ai-powered",
    "open-source",
    "self-hosted",
    "cross-platform",
    "peer-to-peer",

    "photoshop-alternative",
    "airdrop-alternative",
    "google-alternative-finder",

    "osint",
    "music",
    "travel",
    "webcam",
    "voice-ai",
    "video-ai",
    "video-generation",
    "image-generation",
    "text-generation",
    "coding-assistant",
    "search-engine",
    "social-network",
    "writing",
    "seo",
    "public-records",
    "corporate-data",
    "piracy-risk",
    "retro",
    "podcasting",
    "audio-editing",
    "background-removal",
    "payments",
    "iot",
    "wifi",
    "academic",
    "citation-graph",
    "source-code-search",
    "tool-directory",
    "web-archive",
    "geolocation",
    "pdf-tools",
    "video-editing",

    "data-visualization",
    "mapping",
    "power-mapping",
    "flight-tracking",
    "simulation",
    "privacy-risk",
    "facial-recognition",
    "password-manager",
    "documentation",
    "diagramming",
    "whiteboard",
    "image-compression",
    "data-breach",
    "streaming-guide",
    "recipe",
    "sound-generator",
    "focus",
    "writing-editor",

    "portfolio",
    "education",
    "travel-booking",
    "website-builder",
    "no-code",
    "workflow-automation",
    "project-management",
    "transcription",
    "zapier-alternative",
    "drawing",
    "game",

    "interior-design",
    "photo-restoration",
    "photo-animation",
    "meta",
    "microsoft",

    "note-taking",
    "wiki",
    "database",
    "photo-backup",
    "video-backup",
    "e-signature",
    "scheduling",
    "email-marketing",
    "newsletter",
    "link-shortener",
    "analytics",
    "remote-desktop",
    "voice-dictation",

    "agent-skill",
    "skill-pack",
    "marketplace",
    "mcp",
    "library",
    "prompt-library"
  ]
}
